{
  "schemaVersion": "1.0.0",
  "id": "local:collect-room-3d",
  "name": "Collect Room 3D",
  "engine": {
    "version": "0.2.0-alpha.1",
    "projectFormat": "1.0.0"
  },
  "entry": {
    "scene": "scenes/main.game.json"
  },
  "templates": [
    {
      "id": "core:base",
      "version": "1.0.0"
    },
    {
      "id": "core:3d",
      "version": "2.0.0-alpha.1"
    },
    {
      "id": "core:empty",
      "version": "2.0.0-alpha.1"
    },
    {
      "id": "core:windows",
      "version": "1.0.0"
    }
  ],
  "targets": ["windows-x86_64"],
  "defaultTarget": "windows-x86_64",
  "capabilities": [
    "3d",
    "ai-changesets",
    "deterministic-replay",
    "perspective-camera",
    "physics-3d",
    "primitive-mesh",
    "project-skills",
    "ui",
    "windows-build"
  ],
  "paths": {
    "assets": "assets",
    "scenes": "scenes",
    "tests": "tests",
    "replays": "replays"
  }
}
